<?xml version="1.0" encoding="UTF-8"?>
<!DOCTYPE Orders[
<!ELEMENT Order (WitcherName, MonsterName, CountOfMoney)>
<!ATTLIST Order Id ID #REQUIRED>
<!ELEMENT WitcherName (#PCDATA)>
<!ELEMENT MonsterName (#PCDATA)>
<!ELEMENT CountOfMoney (#PCDATA)>
]>
<Orders 123="1">
  <?PITarget PIContent?>
  <Order Id="1">
    <WitcherName>Bruce</WitcherName>
    <MonsterName>Succubus</MonsterName>
    <CountOfMoney>9954</CountOfMoney>
  </Order>
  <Order Id="2">
    <WitcherName>Andrew</WitcherName>
    <MonsterName>Ekhidna</MonsterName>
    <CountOfMoney>453</CountOfMoney>
    <!--O hi there)-->
  </Order>
  <Order Id="3">
    <WitcherName>Alan</WitcherName>
    <MonsterName>Ekhidna</MonsterName>
    <CountOfMoney>6513</CountOfMoney>
  </Order>
  <Order Id="4">
    <WitcherName>Blake</WitcherName>
    <MonsterName>Water hag</MonsterName>
    <CountOfMoney>8066</CountOfMoney>
  </Order>
  <Order Id="5">
    <WitcherName>Blake</WitcherName>
    <MonsterName>Barghest</MonsterName>
    <CountOfMoney>4660</CountOfMoney>
  </Order>
  <Order Id="6">
    <WitcherName>Noah</WitcherName>
    <MonsterName>Higher Vampire</MonsterName>
    <CountOfMoney>3807</CountOfMoney>
  </Order>
  <Order Id="7">
    <WitcherName>Rodrigo</WitcherName>
    <MonsterName>Doppler</MonsterName>
    <CountOfMoney>2521</CountOfMoney>
  </Order>
  <Order Id="8">
    <WitcherName>Clifford</WitcherName>
    <MonsterName>Giant centipedes</MonsterName>
    <CountOfMoney>7249</CountOfMoney>
  </Order>
  <Order Id="9">
    <WitcherName>Clifford</WitcherName>
    <MonsterName>Alp</MonsterName>
    <CountOfMoney>97</CountOfMoney>
  </Order>
  <Order Id="10">
    <WitcherName>Justin</WitcherName>
    <MonsterName>Alp</MonsterName>
    <CountOfMoney>4605</CountOfMoney>
  </Order>
  <Order Id="12">
    <WitcherName>Dylan</WitcherName>
    <MonsterName>Giant centipedes</MonsterName>
    <CountOfMoney>9843</CountOfMoney>
  </Order>
  <Order Id="13">
    <WitcherName>Noah</WitcherName>
    <MonsterName>Golem</MonsterName>
    <CountOfMoney>3095</CountOfMoney>
  </Order>
  <Order Id="14">
    <WitcherName>Jesus</WitcherName>
    <MonsterName>Sandcrabs</MonsterName>
    <CountOfMoney>892</CountOfMoney>
  </Order>
  <Order Id="15">
    <WitcherName>Alexander</WitcherName>
    <MonsterName>Rotfiend</MonsterName>
    <CountOfMoney>5741</CountOfMoney>
  </Order>
  <Order Id="16">
    <WitcherName>Colin</WitcherName>
    <MonsterName>Nekker</MonsterName>
    <CountOfMoney>6244</CountOfMoney>
  </Order>
  <Order Id="17">
    <WitcherName>Jaden</WitcherName>
    <MonsterName>Djinn</MonsterName>
    <CountOfMoney>1522</CountOfMoney>
  </Order>
  <Order Id="18">
    <WitcherName>Dominic</WitcherName>
    <MonsterName>Endrega</MonsterName>
    <CountOfMoney>3203</CountOfMoney>
  </Order>
  <Order Id="19">
    <WitcherName>Alan</WitcherName>
    <MonsterName>Barghest</MonsterName>
    <CountOfMoney>5241</CountOfMoney>
  </Order>
  <Order Id="20">
    <WitcherName>Bryan</WitcherName>
    <MonsterName>Earth Elemental</MonsterName>
    <CountOfMoney>8923</CountOfMoney>
  </Order>
  <Order Id="21">
    <WitcherName>Cole</WitcherName>
    <MonsterName>Arachasae</MonsterName>
    <CountOfMoney>5135</CountOfMoney>
  </Order>
  <Order Id="22">
    <WitcherName>Ralph</WitcherName>
    <MonsterName>Plague maiden</MonsterName>
    <CountOfMoney>1160</CountOfMoney>
  </Order>
  <Order Id="23">
    <WitcherName>Jeremiah</WitcherName>
    <MonsterName>Rotfiend</MonsterName>
    <CountOfMoney>6185</CountOfMoney>
  </Order>
  <Order Id="24">
    <WitcherName>Bruce</WitcherName>
    <MonsterName>Plague maiden</MonsterName>
    <CountOfMoney>7124</CountOfMoney>
  </Order>
  <Order Id="25">
    <WitcherName>Noah</WitcherName>
    <MonsterName>Golem</MonsterName>
    <CountOfMoney>7875</CountOfMoney>
  </Order>
  <Order Id="26">
    <WitcherName>Caleb</WitcherName>
    <MonsterName>Nekker</MonsterName>
    <CountOfMoney>3602</CountOfMoney>
  </Order>
  <Order Id="27">
    <WitcherName>Chase</WitcherName>
    <MonsterName>Higher Vampire</MonsterName>
    <CountOfMoney>6628</CountOfMoney>
  </Order>
  <Order Id="28">
    <WitcherName>Neil</WitcherName>
    <MonsterName>Ice troll</MonsterName>
    <CountOfMoney>2525</CountOfMoney>
  </Order>
  <Order Id="29">
    <WitcherName>Nicholas</WitcherName>
    <MonsterName>Golem</MonsterName>
    <CountOfMoney>1233</CountOfMoney>
  </Order>
  <Order Id="30">
    <WitcherName>Brian</WitcherName>
    <MonsterName>Foglet</MonsterName>
    <CountOfMoney>3445</CountOfMoney>
  </Order>
  <Order Id="31">
    <WitcherName>Colin</WitcherName>
    <MonsterName>Wyverns</MonsterName>
    <CountOfMoney>8739</CountOfMoney>
  </Order>
</Orders>